,title,abstract,decision,zero_shot
89,"Molecular sources of residual cardiovascular risk, clinical signals, and innovative solutions: relationship with subclinical disease, undertreatment, and poor adherence: implications of new evidence upon optimizing cardiovascular patient outcomes","Residual risk, the ongoing appreciable risk of major cardiovascular events (MCVE) in statin-treated patients who have achieved evidence-based lipid goals, remains a concern among cardiologists. Factors that contribute to this continuing risk are atherogenic non-low-density lipoprotein (LDL) particles and atherogenic processes unrelated to LDL cholesterol, including other risk factors, the inherent properties of statin drugs, and patient characteristics, ie, genetics and behaviors. In addition, providers, health care systems, the community, public policies, and the environment play a role. Major statin studies suggest an average 28% reduction in LDL cholesterol and a 31% reduction in relative risk, leaving a residual risk of about 69%. Incomplete reductions in risk, and failure to improve conditions that create risk, may result in ongoing progression of atherosclerosis, with new and recurring lesions in original and distant culprit sites, remodeling, arrhythmias, rehospitalizations, invasive procedures, and terminal disability. As a result, identification of additional agents to reduce residual risk, particularly administered together with statin drugs, has been an ongoing quest. The current model of atherosclerosis involves many steps during which disease may progress independently of guideline-defined elevations in LDL cholesterol. Differences in genetic responsiveness to statin therapy, differences in ability of the endothelium to regenerate and repair, and differences in susceptibility to nonlipid risk factors, such as tobacco smoking, hypertension, and molecular changes associated with obesity and diabetes, may all create residual risk. A large number of inflammatory and metabolic processes may also provide eventual therapeutic targets to lower residual risk. Classically, epidemiologic and other evidence suggested that raising high-density lipoprotein (HDL) cholesterol would be cardioprotective. When LDL cholesterol is aggressively lowered to targets, low HDL cholesterol levels are still inversely related to MCVE. The efflux capacity, or ability to relocate cholesterol out of macrophages, is believed to be a major antiatherogenic mechanism responsible for reduction in MCVE mediated in part by healthy HDL. HDL cholesterol is a complex molecule with antioxidative, anti-inflammatory, anti-thrombotic, antiplatelet, and vasodilatory properties, among which is protection of LDL from oxidation. HDL-associated paraoxonase-1 has a major effect on endothelial function. Further, HDL promotes endothelial repair and progenitor cell health, and supports production of nitric oxide. HDL from patients with cardiovascular disease, diabetes, and autoimmune disease may fail to protect or even become proinflammatory or pro-oxidant. Mendelian randomization and other clinical studies in which raising HDL cholesterol has not been beneficial suggest that high plasma levels do not necessarily reduce cardiovascular risk. These data, coupled with extensive preclinical information about the functional heterogeneity of HDL, challenge the ""HDL hypothesis"", ie, raising HDL cholesterol per se will reduce MCVE. After the equivocal AIM-HIGH (Atherothrombosis Intervention in Metabolic Syndrome With Low HDL/High Triglycerides: Impact on Global Health Outcomes) study and withdrawal of two major cholesteryl ester transfer protein compounds, one for off-target adverse effects and the other for lack of efficacy, development continues for two other agents, ie, anacetrapib and evacetrapib, both of which lower LDL cholesterol substantially. The negative but controversial HPS2-THRIVE (the Heart Protection Study 2-Treatment of HDL to Reduce the Incidence of Vascular Events) trial casts further doubt on the HDL cholesterol hypothesis. The growing impression that HDL functionality, rather than abundance, is clinically important is supported by experimental evidence highlighting the conditional pleiotropic actions of HDL. Non-HDL cholesterol reflects the cholesterol in all atherogenic particles containing apolipoprotein B, and has outperformed LDL cholesterol as a lipid marker of cardiovascular risk and future mortality. In addition to including a measure of residual risk, the advantages of using non-HDL cholesterol as a primary lipid target are now compelling. Reinterpretation of data from the Treating to New Targets study suggests that better control of smoking, body weight, hypertension, and diabetes will help lower residual risk. Although much improved, control of risk factors other than LDL cholesterol currently remains inadequate due to shortfalls in compliance with guidelines and poor patient adherence. More efficient and greater use of proven simple therapies, such as aspirin, beta-blockers, angiotensin-converting enzyme inhibitors and angiotensin II receptor blockers, combined with statin therapy, may be more fruitful in improving outcomes than using other complex therapies. Comprehensive, intensive, multimechanistic, global, and national programs using primordial, primary, and secondary prevention to lower the total level of cardiovascular risk are necessary.",Included,Included
76,Multiple genetic variants explain measurable variance in type 2 diabetes-related traits in Pakistanis,"AIMS/HYPOTHESIS: Multiple genetic variants are associated with type 2 diabetes-related traits in Europeans, but their role in South Asian populations needs further study. We hypothesised that genetic variants associated with diabetes-related traits in Europeans would explain a similar proportion of phenotypic variance in a Pakistani population and could be used in Mendelian randomisation analyses., METHODS: We used data from 2,131 individuals from the Control of Blood Pressure and Risk Attenuation Trial (COBRA) in Karachi, Pakistan. Individuals were aged 40 years or older., RESULTS: Combining information from multiple genetic variants showed that fasting glucose, BMI, triacylglycerol, and systolic and diastolic blood pressure variants explained 2.9%, 0.7%, 5.5%, 1.2% and 1.8% of the variance in those traits respectively. Genetic risk scores of fasting glucose, triacylglycerol, BMI, systolic blood pressure and diastolic blood pressure variants were associated with these traits, with per allele SD effects of 0.057 (95% CI 0.041, 0.074), p=3.44 x 10(-12), 0.130 (95% CI 0.105, 0.155), p=2.9 x 10(-21), 0.04 (95% CI 0.014, 0.072), p=0.004, 0.031 (95% CI 0.016, 0.047), p=7.9 x 10(-5), 0.028 (95% CI 0.015, 0.042), p = 5.5 x 10(-5), respectively. These effects are consistent with those observed in Europeans, except that the effect of triacylglycerol variants in South Asians was slightly lower. Mendelian randomisation provided evidence that genetically influenced, raised triacylglycerol levels do not causally affect type 2 diabetes risk to the extent predicted from observational data (p=0.0003 for difference between observed and instrumental variables correlations)., CONCLUSIONS/INTERPRETATION: Genetic variants identified in Europeans are associated with type 2 diabetes-related traits in Pakistanis, with comparable effect sizes. Larger studies are needed to perform adequately powered Mendelian randomisation and help dissect the relationships between type 2 diabetes-related traits in diverse South Asian subgroups.",Included,Included
22,Negative Effects of Age at Menarche on Risk of Cardiometabolic Diseases in Adulthood: A Mendelian Randomization Study,"CONTEXT: Observational studies have demonstrated that early menarche is associated with cardiometabolic diseases, but confounding factors make it difficult to infer causality., OBJECTIVE: We used Mendelian randomization (MR) to examine whether age at menarche (AAM) is causally associated with type 2 diabetes (T2D), coronary artery disease (CAD) and cardiometabolic traits., DESIGN AND METHODS: A 2-sample MR analysis was conducted using genome-wide association study (GWAS) summary statistics from the Diabetes Genetics Replication and Meta-analysis (DIAGRAM) consortium (n = 159 208) for T2D and the Coronary Artery Disease Genome-wide Replication and Meta-analysis plus the Coronary Artery Disease Genetics (CARDIoGRAMplusC4D) consortium (n = 184 305) for CAD. We used 122 instrumental variables (IVs) extracted from a published GWAS meta-analysis incorporating 182 416 women to determine the causal effect of AAM on cardiometabolic diseases, treating childhood and adult body mass index (BMI) as the confounders. Sensitivity analyses were also performed to detect the pleiotropy of the IVs., RESULTS: Employing the MR approach, we found that later AAM was associated with decreased risk of CAD (OR, 0.92 [95% CI, 0.88-0.96]; P = 2.06 x 10-4) in adults, as well as lower blood levels of log fasting insulin, log homeostatic model assessment of insulin resistance (HOMA-IR), log HOMA of beta-cell function (HOMA-B), triglycerides, and diastolic blood pressure, but higher blood level of high-density lipoprotein. However, the associations were substantially attenuated after excluding BMI-related variants. MR analyses provide little evidence on the causal effect between AAM and T2D., CONCLUSIONS: Our findings showed that AAM did not appear to have a causal effect on the risk of cardiometabolic diseases in adult life, as their associations observed in epidemiological studies might be largely mediated through excessive adiposity. We propose adiposity might be a primary target in future intervention strategy. Copyright © Endocrine Society 2019. All rights reserved. For permissions, please e-mail: journals.permissions@oup.com.",Included,Included
57,New strategies for the development of lipid-lowering therapies to reduce cardiovascular risk,"The very high occurrence of cardiovascular events presents a major public health issue, because treatment remains suboptimal. Lowering LDL cholesterol (LDL-C) with statins or ezetimibe in combination with a statin reduces major adverse cardiovascular events. The cardiovascular risk reduction in relation to the absolute LDL-C reduction is linear for most interventions without evidence of attenuation or increase in risk at low LDL-C levels. Opportunities for innovation in dyslipidaemia treatment should address the substantial risk of lipid-associated cardiovascular events among patients optimally treated per guidelines but who cannot achieve LDL-C goals and who could benefit from additional LDL-C-lowering therapy or experience side effects of statins. Fresh approaches are needed to identify promising drug targets early and develop them efficiently. The Cardiovascular Round Table of the European Society of Cardiology (ESC) convened a workshop to discuss new lipid-lowering strategies for cardiovascular risk reduction. Opportunities to improve treatment approaches and the efficient study of new therapies were explored. Circulating biomarkers may not be fully reliable proxy indicators of the relationship between treatment effect and clinical outcome. Mendelian randomization studies may better inform development strategies and refine treatment targets before Phase 3. Trials should match the drug to appropriate lipid and patient profile, and guidelines may move towards a precision-based approach to individual patient management. Stakeholder collaboration is needed to ensure continued innovation and better international coordination of both regulatory aspects and guidelines. It should be noted that risk may also be addressed through increased attention to other risk factors such as smoking, hypertension, overweight, and inactivity.",Included,Included
40,Nonalcoholic fatty liver disease or metabolic dysfunction-associated fatty liver disease diagnoses and cardiovascular diseases: From epidemiology to drug approaches,"BACKGROUND: A consensus of experts has proposed to replace the term nonalcoholic fatty liver disease (NAFLD), whose global prevalence is 25%, with metabolic dysfunction-associated fatty liver disease (MAFLD), to describe more appropriately the liver disease related to metabolic derangements. MAFLD is closely intertwined with type 2 diabetes, obesity, dyslipidaemia, all linked to a rise in the risk of cardiovascular disease (CVDs). Since controversy still stands on whether or not NAFLD/MAFLD raises the odds of CVD, the present review aims to evaluate the impact of NAFLD/MAFLD aetiologies on CV health and the potential correction by dietary and drug approaches., RESULTS: Epidemiological studies indicate that NAFLD raises risk of fatal or non-fatal CVD events. NAFLD patients have a higher prevalence of arterial plaques and stiffness, coronary calcification, and endothelial dysfunction. Although genetic and environmental factors strongly contribute to NAFLD pathogenesis, a Mendelian randomization analysis indicated that the PNPLA3 genetic variant leading to NAFLD may not be causally associated with CVD risk. Among other genetic variants related to NAFLD, TM6SF2 appears to be protective, whereas MBOAT7 may favour venous thromboembolism., CONCLUSIONS: NAFLD is correlated to a higher CVD risk which may be ameliorated by dietary interventions. This is not surprising, since new criteria defining MAFLD include other metabolic risk abnormalities fuelling development of serious adverse extrahepatic outcomes, for example CVD. The present lack of a targeted pharmacological approach makes the identification of patients with liver disease at higher CVD risk (eg diabetes, hypertension, obesity or high levels of C-reactive protein) of major clinical interest. Copyright © 2021 Stichting European Society for Clinical Investigation Journal Foundation. Published by John Wiley & Sons Ltd.",Excluded,Excluded
18,"Nonfasting glucose, ischemic heart disease, and myocardial infarction: a Mendelian randomization study","OBJECTIVES: The purpose of this study was to test whether elevated nonfasting glucose levels associate with and cause ischemic heart disease (IHD) and myocardial infarction (MI)., BACKGROUND: Elevated fasting plasma glucose levels associate with increased risk of IHD, but whether this is also true for nonfasting levels and whether this is a causal relationship is unknown., METHODS: Using a Mendelian randomization approach, we studied 80,522 persons from Copenhagen, Denmark. Of those, IHD developed in 14,155, and MI developed in 6,257. Subjects were genotyped for variants in GCK (rs4607517), G6PC2 (rs560887), ADCY5 (rs11708067), DGKB (rs2191349), and ADRA2A (rs10885122) associated with elevated fasting glucose levels in genome-wide association studies., RESULTS: Risk of IHD and MI increased stepwise with increasing nonfasting glucose levels. The hazard ratio for IHD in subjects with nonfasting glucose levels >=11 mmol/l (>=198 mg/dl) versus <5 mmol/l (<90 mg/dl) was 6.9 (95% confidence interval [CI]: 4.2 to 11.2) adjusted for age and sex, and 2.3 (95% CI: 1.3 to 4.2) adjusted multifactorially; corresponding values for MI were 9.2 (95% CI: 4.6 to 18.2) and 4.8 (95% CI: 2.1 to 11.2). Increasing number of glucose-increasing alleles was associated with increasing nonfasting glucose levels and with increased risk of IHD and MI. The estimated causal odds ratio for IHD and MI by instrumental variable analysis for a 1-mmol/l (18-mg/dl) increase in nonfasting glucose levels due to genotypes combined were 1.25 (95% CI: 1.03 to 1.52) and 1.69 (95% CI: 1.28 to 2.23), and the corresponding observed hazard ratio for IHD and MI by Cox regression was 1.18 (95% CI: 1.15 to 1.22) and 1.09 (95% CI: 1.07 to 1.11), respectively., CONCLUSIONS: Like common nonfasting glucose elevation, plasma glucose-increasing polymorphisms associate with increased risk of IHD and MI. These data are compatible with a causal association. Copyright © 2012 American College of Cardiology Foundation. Published by Elsevier Inc. All rights reserved.",Included,Included
166,Novel loci for childhood body mass index and shared heritability with adult cardiometabolic traits,"The genetic background of childhood body mass index (BMI), and the extent to which the well-known associations of childhood BMI with adult diseases are explained by shared genetic factors, are largely unknown. We performed a genome-wide association study meta-analysis of BMI in 61,111 children aged between 2 and 10 years. Twenty-five independent loci reached genome-wide significance in the combined discovery and replication analyses. Two of these, located near NEDD4L and SLC45A3, have not previously been reported in relation to either childhood or adult BMI. Positive genetic correlations of childhood BMI with birth weight and adult BMI, waist-to-hip ratio, diastolic blood pressure and type 2 diabetes were detected (Rg ranging from 0.11 to 0.76, P-values <0.002). A negative genetic correlation of childhood BMI with age at menarche was observed. Our results suggest that the biological processes underlying childhood BMI largely, but not completely, overlap with those underlying adult BMI. The well-known observational associations of BMI in childhood with cardio-metabolic diseases in adulthood may reflect partial genetic overlap, but in light of previous evidence, it is also likely that they are explained through phenotypic continuity of BMI from childhood into adulthood.",Excluded,Excluded
117,Obesity and ischemic heart disease: defining the link,No abstract available,Excluded,Excluded
74,Obesity and peripheral arterial disease: A Mendelian Randomization analysis,"BACKGROUND AND AIMS: Observational studies showed that obesity is a major risk factor for peripheral arterial disease (PAD). However, conventional epidemiology studies are vulnerable to residual bias from confounding factors. We aimed to explore the causality of obesity in development of PAD using Mendelian Randomization (MR) approach., METHODS: A MR analysis was performed in 11,477 community-dwelling adults aged 40 years and above recruited from two nearby communities during 2011-2013 in Shanghai, China. We genotyped 14 body mass index (BMI) associated common variants identified and validated in East Asians. PAD was defined as ankle-to-brachial index (ABI) <0.90 or >1.40. Weighted BMI genetic risk score (GRS) was used as the Instrumental Variable (IV)., RESULTS: After adjusted for confounding factors, we found that each standard deviation (SD, 2.76 points) increase in BMI-GRS was associated with 0.43 (95% confidence interval [CI]: 0.36-0.49) kg/m(2) increase in BMI (P < 0.0001) and an odds ratio (OR) for PAD of 1.17 (95% CI: 1.07-1.27; P = 0.0004). Compared with the lowest quartile of BMI-GRS, the second, third and highest quartile associated with 9%, 19% and 45% increment of PAD risk, respectively (P for trend = 0.002). In the MR analysis, we demonstrated a causal relationship between obesity and PAD (OR = 1.44 per BMI-unit, 95% CI: 1.18-1.75; P = 0.0003)., CONCLUSIONS: This study suggested that obesity may be causally associated with PAD after controlling for the potential intermediate factors like hypertension, dyslipidemia and hyperglycemia. Copyright © 2016. Published by Elsevier Ireland Ltd.",Included,Included
1,Obesity increases the risk of cardiovascular disease,"Evidence from epidemiology, randomized intervention trials, and Mendelian randomization studies indicates that obesity is causally associated with increased burden of cardiovascular disease risk factors and increased risk of cardiovascular disease. This association is probably mediated by modifiable risk factors; thus indicating that primary prevention with weight loss and treatment of obesity-related risk factors for cardiovascular disease will reduce cardiovascular disease in the general population.",Included,Included
174,On the Use of the Lasso for Instrumental Variables Estimation with Some Invalid Instruments,"We investigate the behavior of the Lasso for selecting invalid instruments in linear instrumental variables models for estimating causal effects of exposures on outcomes, as proposed recently by Kang et al. Invalid instruments are such that they fail the exclusion restriction and enter the model as explanatory variables. We show that for this setup, the Lasso may not consistently select the invalid instruments if these are relatively strong. We propose a median estimator that is consistent when less than 50% of the instruments are invalid, and its consistency does not depend on the relative strength of the instruments, or their correlation structure. We show that this estimator can be used for adaptive Lasso estimation, with the resulting estimator having oracle properties. The methods are applied to a Mendelian randomization study to estimate the causal effect of body mass index (BMI) on diastolic blood pressure, using data on individuals from the UK Biobank, with 96 single nucleotide polymorphisms as potential instruments for BMI. Supplementary materials for this article are available online. Copyright © 2018 The Author(s). Published by Informa UK Limited, trading as Taylor & Francis Group.",Excluded,Excluded
118,Phenome-wide Mendelian-randomization study of genetically determined vitamin D on multiple health outcomes using the UK Biobank study,"BACKGROUND: Vitamin D deficiency is highly prevalent across the globe. Existing studies suggest that a low vitamin D level is associated with more than 130 outcomes. Exploring the causal role of vitamin D in health outcomes could support or question vitamin D supplementation., METHODS: We carried out a systematic literature review of previous Mendelian-randomization studies on vitamin D. We then implemented a Mendelian Randomization-Phenome Wide Association Study (MR-PheWAS) analysis on data from 339 256 individuals of White British origin from UK Biobank. We first ran a PheWAS analysis to test the associations between a 25(OH)D polygenic risk score and 920 disease outcomes, and then nine phenotypes (i.e. systolic blood pressure, diastolic blood pressure, risk of hypertension, T2D, ischaemic heart disease, body mass index, depression, non-vertebral fracture and all-cause mortality) that met the pre-defined inclusion criteria for further analysis were examined by multiple MR analytical approaches to explore causality., RESULTS: The PheWAS analysis did not identify any health outcome associated with the 25(OH)D polygenic risk score. Although a selection of nine outcomes were reported in previous Mendelian-randomization studies or umbrella reviews to be associated with vitamin D, our MR analysis, with substantial study power (>80% power to detect an association with an odds ratio >1.2 for per standard deviation increase of log-transformed 25[OH]D), was unable to support an interpretation of causal association., CONCLUSIONS: We investigated the putative causal effects of vitamin D on multiple health outcomes in a White population. We did not support a causal effect on any of the disease outcomes tested. However, we cannot exclude small causal effects or effects on outcomes that we did not have enough power to explore due to the small number of cases. Copyright © The Author(s) 2019. Published by Oxford University Press on behalf of the International Epidemiological Association.",Included,Included
39,Phenome-wide investigation of the causal associations between childhood BMI and adult trait outcomes: a two-sample Mendelian randomization study,"BACKGROUND: Childhood obesity is reported to be associated with the risk of many diseases in adulthood. However, observational studies cannot fully account for confounding factors. We aimed to systematically assess the causal associations between childhood body mass index (BMI) and various adult traits/diseases using two-sample Mendelian randomization (MR)., METHODS: After data filtering, 263 adult traits genetically correlated with childhood BMI (P < 0.05) were subjected to MR analyses. Inverse-variance weighted, MR-Egger, weighted median, and weighted mode methods were used to estimate the causal effects. Multivariable MR analysis was performed to test whether the effects of childhood BMI on adult traits are independent from adult BMI., RESULTS: We identified potential causal effects of childhood obesity on 60 adult traits (27 disease-related traits, 27 lifestyle factors, and 6 other traits). Higher childhood BMI was associated with a reduced overall health rating (beta = - 0.10, 95% CI - 0.13 to - 0.07, P = 6.26 x 10-11). Specifically, higher childhood BMI was associated with increased odds of coronary artery disease (OR = 1.09, 95% CI 1.06 to 1.11, P = 4.28 x 10-11), essential hypertension (OR = 1.12, 95% CI 1.08 to 1.16, P = 1.27 x 10-11), type 2 diabetes (OR = 1.36, 95% CI 1.30 to 1.43, P = 1.57 x 10-34), and arthrosis (OR = 1.09, 95% CI 1.06 to 1.12, P = 8.80 x 10-9). However, after accounting for adult BMI, the detrimental effects of childhood BMI on disease-related traits were no longer present (P > 0.05). For dietary habits, different from conventional understanding, we found that higher childhood BMI was associated with low calorie density food intake. However, this association might be specific to the UK Biobank population., CONCLUSIONS: In summary, we provided a phenome-wide view of the effects of childhood BMI on adult traits. Multivariable MR analysis suggested that the associations between childhood BMI and increased risks of diseases in adulthood are likely attributed to individuals remaining obese in later life. Therefore, ensuring that childhood obesity does not persist into later life might be useful for reducing the detrimental effects of childhood obesity on adult diseases.",Included,Included
