,title,abstract,decision,zero_shot
36,Feasibility of a Risk-Based Approach to Cataract Surgery Preoperative Medical Evaluation,"IMPORTANCE: In 2019, the US Centers for Medicare & Medicaid Services implemented the Patients Over Paperwork initiative, allowing hospitals and ambulatory surgery centers to establish their own policies on preoperative history and physical requirements. A risk-based approach to preoperative medical evaluation may allow surgeons to provide high-value patient care., OBJECTIVE: To assess the feasibility of a risk-based approach to cataract surgery preoperative medical evaluation through a lens of safety and throughput., DESIGN, SETTING, AND PARTICIPANTS: A pilot study was performed to evaluate the implementation of a risk-based approach to preoperative medical evaluation for cataract surgery using a virtual medical history questionnaire. The intervention group, seen from June to September 2020, received the risk assessment and those who were low risk proceeded to surgery without further preoperative evaluation prior to the day of surgery. The preintervention control group included patients who received standard care from January to December 2019., MAIN OUTCOMES AND MEASURES: Primary outcomes included rates of intraoperative complications, noneye-related emergency department visits within 7 days, inpatient admissions within 7 days of surgery, case delays, and rates of case cancellation. The secondary outcome included patient perception regarding preoperative care., RESULTS: A total of 1095 patients undergoing cataract surgery were included in the intervention group (1813 [58.2%] female) and 3114 were in the control group (621/1095 [56.7%] female). The mean (SD) age was 68.6 (11.0) in the control group and 68.4 (10.5) in the intervention group. The intervention group included 126 low-risk individuals (11.5%) and 969 individuals who received standard care (88.5%). There were no differences between the control and intervention groups in terms of rates of intraoperative complications (control group vs intervention group: 21 [0.7%] vs 3 [0.3%]; difference, -0.4% [95% CI, -0.82 to 0.02]), 7-day noneye-related ED visits (5 [0.2%] vs 3 [0.3%]; difference, 0.1% [95% CI, -0.23 to 0.45]), 7-day inpatient admissions (6 [0.2%] vs 2 [0.2%]; difference, -0.01% [95% CI, -0.31 to 0.29]), or same-day cancellations (31 [0.8%] vs 10 [0.6%]; difference, -0.15% [95% CI, -0.63 to 0.34]). The control group had more case delays (59 [1.9%] vs 7 [0.6%]; difference, -1.3% [95% CI, -1.93 to -0.58])., CONCLUSIONS AND RELEVANCE: This study suggests that a virtual, risk-based approach to preoperative medical evaluations for cataract surgery is associated with safe and efficient outcomes. These findings may encourage health care systems and ambulatory surgery centers to tailor preoperative requirements for low-risk surgery patients.",Excluded,Excluded
99,From the Editor,No abstract available,Excluded,Excluded
42,"Genetic Association of Waist-to-Hip Ratio With Cardiometabolic Traits, Type 2 Diabetes, and Coronary Heart Disease","Importance: In observational studies, abdominal adiposity has been associated with type 2 diabetes and coronary heart disease (CHD). Whether these associations represent causal relationships remains uncertain., Objective: To test the association of a polygenic risk score for waist-to-hip ratio (WHR) adjusted for body mass index (BMI), a measure of abdominal adiposity, with type 2 diabetes and CHD through the potential intermediates of blood lipids, blood pressure, and glycemic phenotypes., Design, Setting, and Participants: A polygenic risk score for WHR adjusted for BMI, a measure of genetic predisposition to abdominal adiposity, was constructed with 48 single-nucleotide polymorphisms. The association of this score with cardiometabolic traits, type 2 diabetes, and CHD was tested in a mendelian randomization analysis that combined case-control and cross-sectional data sets. Estimates for cardiometabolic traits were based on a combined data set consisting of summary results from 4 genome-wide association studies conducted from 2007 to 2015, including up to 322154 participants, as well as individual-level, cross-sectional data from the UK Biobank collected from 2007-2011, including 111986 individuals. Estimates for type 2 diabetes and CHD were derived from summary statistics of 2 separate genome-wide association studies conducted from 2007 to 2015 and including 149821 individuals and 184305 individuals, respectively, combined with individual-level data from the UK Biobank., Exposures: Genetic predisposition to increased WHR adjusted for BMI., Main Outcomes and Measures: Type 2 diabetes and CHD., Results: Among 111986 individuals in the UK Biobank, the mean age was 57 (SD, 8) years, 58845 participants (52.5%) were women, and mean WHR was 0.875. Analysis of summary-level genome-wide association study results and individual-level UK Biobank data demonstrated that a 1-SD increase in WHR adjusted for BMI mediated by the polygenic risk score was associated with 27-mg/dL higher triglyceride levels, 4.1-mg/dL higher 2-hour glucose levels, and 2.1-mm Hg higher systolic blood pressure (each P < .001). A 1-SD genetic increase in WHR adjusted for BMI was also associated with a higher risk of type 2 diabetes (odds ratio, 1.77 [95% CI, 1.57-2.00]; absolute risk increase per 1000 participant-years, 6.0 [95% CI, CI, 4.4-7.8]; number of participants with type 2 diabetes outcome, 40530) and CHD (odds ratio, 1.46 [95% CI, 1.32-1.62]; absolute risk increase per 1000 participant-years, 1.8 [95% CI, 1.3-2.4]; number of participants with CHD outcome, 66440)., Conclusions and Relevance: A genetic predisposition to higher waist-to-hip ratio adjusted for body mass index was associated with increased risk of type 2 diabetes and coronary heart disease. These results provide evidence supportive of a causal association between abdominal adiposity and these outcomes.",Included,Included
160,Genetic Determinants of Body Mass Index and Fasting Glucose Are Mediators of Grade 1 Diastolic Dysfunction,"Background Early (grade 1) cardiac left ventricular diastolic dysfunction (G1DD) increases the risk for heart failure with preserved ejection fraction and may improve with aggressive risk factor modification. Type 2 diabetes, obesity, hypertension, and coronary heart disease are associated with increased incidence of diastolic dysfunction. The genetic drivers of G1DD are not defined. Methods and Results We curated genotyped European ancestry G1DD cases (n=668) and controls with normal diastolic function (n=1772) from Vanderbilt's biobank. G1DD status was explored through (1) an additive model genome-wide association study, (2) shared polygenic risk through logistic regression, and (3) instrumental variable analysis using 2-sample Mendelian randomization (the inverse-variance weighted method, Mendelian randomization-Egger, and median) to determine potential modifiable risk factors. There were no common single nucleotide polymorphisms significantly associated with G1DD status. A polygenic risk score for BMI was significantly associated with increased G1DD risk (odds ratio [OR], 1.20 for 1-SD increase in BMI [95% CI, 1.08-1.32]; P=0.0003). The association was confirmed by the inverse-variance weighted method (OR, 1.89 [95% CI, 1.37-2.61]). Among the candidate mediators for BMI, only fasting glucose was significantly associated with G1DD status by the inverse-variance weighted method (OR, 4.14 for 1-SD increase in fasting glucose [95% CI, 1.55-11.02]; P=0.005). Multivariable Mendelian randomization showed a modest attenuation of the BMI association (OR, 1.84 [95% CI, 1.35-2.52]) when adjusting for fasting glucose. Conclusions These data suggest that a genetic predisposition to elevated BMI increases the risk for G1DD. Part of this effect may be mediated through altered glucose homeostasis.",Excluded,Excluded
159,Genetic Evidence for Causal Relationships Between Maternal Obesity-Related Traits and Birth Weight,"IMPORTANCE: Neonates born to overweight or obese women are larger and at higher risk of birth complications. Many maternal obesity-related traits are observationally associated with birth weight, but the causal nature of these associations is uncertain., OBJECTIVE: To test for genetic evidence of causal associations of maternal body mass index (BMI) and related traits with birth weight., DESIGN, SETTING, AND PARTICIPANTS: Mendelian randomization to test whether maternal BMI and obesity-related traits are potentially causally related to offspring birth weight. Data from 30,487 women in 18 studies were analyzed. Participants were of European ancestry from population- or community-based studies in Europe, North America, or Australia and were part of the Early Growth Genetics Consortium. Live, term, singleton offspring born between 1929 and 2013 were included., EXPOSURES: Genetic scores for BMI, fasting glucose level, type 2 diabetes, systolic blood pressure (SBP), triglyceride level, high-density lipoprotein cholesterol (HDL-C) level, vitamin D status, and adiponectin level., MAIN OUTCOME AND MEASURE: Offspring birth weight from 18 studies., RESULTS: Among the 30,487 newborns the mean birth weight in the various cohorts ranged from 3325 g to 3679 g. The maternal genetic score for BMI was associated with a 2-g (95% CI, 0 to 3 g) higher offspring birth weight per maternal BMI-raising allele (P = .008). The maternal genetic scores for fasting glucose and SBP were also associated with birth weight with effect sizes of 8 g (95% CI, 6 to 10 g) per glucose-raising allele (P = 7 x 10(-14)) and -4 g (95% CI, -6 to -2 g) per SBP-raising allele (P = 1x10(-5)), respectively. A 1-SD ( = 4 points) genetically higher maternal BMI was associated with a 55-g higher offspring birth weight (95% CI, 17 to 93 g). A 1-SD ( = 7.2 mg/dL) genetically higher maternal fasting glucose concentration was associated with 114-g higher offspring birth weight (95% CI, 80 to 147 g). However, a 1-SD ( = 10 mm Hg) genetically higher maternal SBP was associated with a 208-g lower offspring birth weight (95% CI, -394 to -21 g). For BMI and fasting glucose, genetic associations were consistent with the observational associations, but for systolic blood pressure, the genetic and observational associations were in opposite directions., CONCLUSIONS AND RELEVANCE: In this mendelian randomization study, genetically elevated maternal BMI and blood glucose levels were potentially causally associated with higher offspring birth weight, whereas genetically elevated maternal SBP was potentially causally related to lower birth weight. If replicated, these findings may have implications for counseling and managing pregnancies to avoid adverse weight-related birth outcomes.",Included,Included
113,Genetic Evidence for Different Adiposity Phenotypes and Their Opposing Influences on Ectopic Fat and Risk of Cardiometabolic Disease,"To understand the causal role of adiposity and ectopic fat in type 2 diabetes and cardiometabolic diseases, we aimed to identify two clusters of adiposity genetic variants: one with ""adverse"" metabolic effects (UFA) and the other with, paradoxically, ""favorable"" metabolic effects (FA). We performed a multivariate genome-wide association study using body fat percentage and metabolic biomarkers from UK Biobank and identified 38 UFA and 36 FA variants. Adiposity-increasing alleles were associated with an adverse metabolic profile, higher risk of disease, higher CRP, and higher fat in subcutaneous and visceral adipose tissue, liver, and pancreas for UFA and a favorable metabolic profile, lower risk of disease, higher CRP and higher subcutaneous adipose tissue but lower liver fat for FA. We detected no sexual dimorphism. The Mendelian randomization studies provided evidence for a risk-increasing effect of UFA and protective effect of FA for type 2 diabetes, heart disease, hypertension, stroke, nonalcoholic fatty liver disease, and polycystic ovary syndrome. FA is distinct from UFA by its association with lower liver fat and protection from cardiometabolic diseases; it was not associated with visceral or pancreatic fat. Understanding the difference in FA and UFA may lead to new insights in preventing, predicting, and treating cardiometabolic diseases. Copyright © 2021 by the American Diabetes Association.",Included,Included
148,Genetic analysis of obstructive sleep apnoea discovers a strong association with cardiometabolic health,"There is currently limited understanding of the genetic aetiology of obstructive sleep apnoea (OSA). We aimed to identify genetic loci associated with OSA risk, and to test if OSA and its comorbidities share a common genetic background. We conducted the first large-scale genome-wide association study of OSA using the FinnGen study (217 955 individuals) with 16 761 OSA patients identified using nationwide health registries. We estimated 0.08 (95% CI 0.06-0.11) heritability and identified five loci associated with OSA (p<5.0x10-8): rs4837016 near GAPVD1 (GTPase activating protein and VPS9 domains 1), rs10928560 near CXCR4 (C-X-C motif chemokine receptor type 4), rs185932673 near CAMK1D (calcium/calmodulin-dependent protein kinase ID) and rs9937053 near FTO (fat mass and obesity-associated protein; a variant previously associated with body mass index (BMI)). In a BMI-adjusted analysis, an association was observed for rs10507084 near RMST/NEDD1 (rhabdomyosarcoma 2 associated transcript/NEDD1 gamma-tubulin ring complex targeting factor). We found high genetic correlations between OSA and BMI (rg=0.72 (95% CI 0.62-0.83)), and with comorbidities including hypertension, type 2 diabetes, coronary heart disease, stroke, depression, hypothyroidism, asthma and inflammatory rheumatic disease (rg>0.30). The polygenic risk score for BMI showed 1.98-fold increased OSA risk between the highest and the lowest quintile, and Mendelian randomisation supported a causal relationship between BMI and OSA.Our findings support the causal link between obesity and OSA, and the joint genetic basis between OSA and comorbidities. Copyright ©ERS 2021. For reproduction rights and permissions contact permissions@ersnet.org.",Included,Included
37,Genetic determinants of daytime napping and effects on cardiometabolic health,"Daytime napping is a common, heritable behavior, but its genetic basis and causal relationship with cardiometabolic health remain unclear. Here, we perform a genome-wide association study of self-reported daytime napping in the UK Biobank (n = 452,633) and identify 123 loci of which 61 replicate in the 23andMe research cohort (n = 541,333). Findings include missense variants in established drug targets for sleep disorders (HCRTR1, HCRTR2), genes with roles in arousal (TRPC6, PNOC), and genes suggesting an obesity-hypersomnolence pathway (PNOC, PATJ). Association signals are concordant with accelerometer-measured daytime inactivity duration and 33 loci colocalize with loci for other sleep phenotypes. Cluster analysis identifies three distinct clusters of nap-promoting mechanisms with heterogeneous associations with cardiometabolic outcomes. Mendelian randomization shows potential causal links between more frequent daytime napping and higher blood pressure and waist circumference.",Included,Included
176,Genetic evidence for a causal relationship between type 2 diabetes and peripheral artery disease in both Europeans and East Asians,"BACKGROUND: Observational studies have revealed that type 2 diabetes (T2D) is associated with an increased risk of peripheral artery disease (PAD). However, whether the two diseases share a genetic basis and whether the relationship is causal remain unclear. It is also unclear as to whether these relationships differ between ethnic groups., METHODS: By leveraging large-scale genome-wide association study (GWAS) summary statistics of T2D (European-based: Ncase = 21,926, Ncontrol = 342,747; East Asian-based: Ncase = 36,614, Ncontrol = 155,150) and PAD (European-based: Ncase = 5673, Ncontrol = 359,551; East Asian-based: Ncase = 3593, Ncontrol = 208,860), we explored the genetic correlation and putative causal relationship between T2D and PAD in both Europeans and East Asians using linkage disequilibrium score regression and seven Mendelian randomization (MR) models. We also performed multi-trait analysis of GWAS and two gene-based analyses to reveal candidate variants and risk genes involved in the shared genetic basis between T2D and PAD., RESULTS: We observed a strong genetic correlation (rg) between T2D and PAD in both Europeans (rg = 0.51; p-value = 9.34 x 10-15) and East Asians (rg = 0.46; p-value = 1.67 x 10-12). The MR analyses provided consistent evidence for a causal effect of T2D on PAD in both ethnicities (odds ratio [OR] = 1.05 to 1.28 for Europeans and 1.15 to 1.27 for East Asians) but not PAD on T2D. This putative causal effect was not influenced by total cholesterol, body mass index, systolic blood pressure, or smoking initiation according to multivariable MR analysis, and the genetic overlap between T2D and PAD was further explored employing an independent European sample through polygenic risk score regression. Multi-trait analysis of GWAS revealed two novel European-specific single nucleotide polymorphisms (rs927742 and rs1734409) associated with the shared genetic basis of T2D and PAD. Gene-based analyses consistently identified one gene ANKFY1 and gene-gene interactions (e.g., STARD10 [European-specific] to AP3S2 [East Asian-specific]; KCNJ11 [European-specific] to KCNQ1 [East Asian-specific]) associated with the trans-ethnic genetic overlap between T2D and PAD, reflecting a common genetic basis for the co-occurrence of T2D and PAD in both Europeans and East Asians., CONCLUSIONS: Our study provides the first evidence for a genetically causal effect of T2D on PAD in both Europeans and East Asians. Several candidate variants and risk genes were identified as being associated with this genetic overlap. Our findings emphasize the importance of monitoring PAD status in T2D patients and suggest new genetic biomarkers for screening PAD risk among patients with T2D. Copyright © 2022. The Author(s).",Included,Included
173,Genetic studies of abdominal MRI data identify genes regulating hepcidin as major determinants of liver iron concentration,"BACKGROUND & AIMS: Excess liver iron content is common and is linked to the risk of hepatic and extrahepatic diseases. We aimed to identify genetic variants influencing liver iron content and use genetics to understand its link to other traits and diseases., METHODS: First, we performed a genome-wide association study (GWAS) in 8,289 individuals from UK Biobank, whose liver iron level had been quantified by magnetic resonance imaging, before validating our findings in an independent cohort (n=1,513 from IMI DIRECT). Second, we used Mendelian randomisation to test the causal effects of 25 predominantly metabolic traits on liver iron content. Third, we tested phenome-wide associations between liver iron variants and 770 traits and disease outcomes., RESULTS: We identified 3 independent genetic variants (rs1800562 [C282Y] and rs1799945 [H63D] in HFE and rs855791 [V736A] in TMPRSS6) associated with liver iron content that reached the GWAS significance threshold (p<5x10-8). The 2 HFE variants account for ~85% of all cases of hereditary haemochromatosis. Mendelian randomisation analysis provided evidence that higher central obesity plays a causal role in increased liver iron content. Phenome-wide association analysis demonstrated shared aetiopathogenic mechanisms for elevated liver iron, high blood pressure, cirrhosis, malignancies, neuropsychiatric and rheumatological conditions, while also highlighting inverse associations with anaemias, lipidaemias and ischaemic heart disease., CONCLUSION: Our study provides genetic evidence that mechanisms underlying higher liver iron content are likely systemic rather than organ specific, that higher central obesity is causally associated with higher liver iron, and that liver iron shares common aetiology with multiple metabolic and non-metabolic diseases., LAY SUMMARY: Excess liver iron content is common and is associated with liver diseases and metabolic diseases including diabetes, high blood pressure, and heart disease. We identified 3 genetic variants that are linked to an increased risk of developing higher liver iron content. We show that the same genetic variants are linked to higher risk of many diseases, but they may also be associated with some health advantages. Finally, we use genetic variants associated with waist-to-hip ratio as a tool to show that central obesity is causally associated with increased liver iron content. Copyright © 2019 European Association for the Study of the Liver. All rights reserved.",Included,Included
170,Genetically Predicted Obesity Causally Increased the Risk of Hypertension Disorders in Pregnancy,"Aims: This study aimed to evaluate the causal association between obesity and hypertension disorders in pregnancy., Methods: Two-sample Mendelian randomization (MR) study was conducted based on the data obtained from the GIANT (n = 98,697 participants) consortium and FinnGen (n = 96,449 participants) consortium to determine the causal effect of obesity on the risk of hypertension disorders in pregnancy. Based on a genome-wide significance, 14 single-nucleotide polymorphisms (SNPs) associated with obesity-related databases were used as instrumental variables. The random-effects inverse-variance weighted (IVW) method was adopted as the main analysis with a supplemented sensitive analysis of the MR-Egger and weighted median approaches., Results: All three MR methods showed that genetically predicted obesity causally increased the risk of hypertension disorders in pregnancy. IVW analysis provided obesity as a risk factor for hypertension disorders in pregnancy with an odds ratio (OR) of 1.39 [95% confidence interval (CI) 1.21-1.59; P = 2.46 x 10-6]. Weighted median and MR Egger regression also showed directionally similar results [weighted median OR = 1.49 (95% CI, 1.24-1.79), P = 2.45 x 10-5; MR-Egger OR = 1.95 (95% CI, 1.35-2.82), P = 3.84 x 10-3]. No directional pleiotropic effects were found between obesity and hypertension disorders in pregnancy with both MR-Egger intercepts and funnel plots., Conclusions: Our findings provided directed evidence that obesity was causally associated with a higher risk of hypertension disorders in pregnancy. Taking measures to reduce the proportion of obesity may help reduce the incidence of hypertension disorders in pregnancy. Copyright © 2022 Wang, Tan, Hua, Zhu, Lin, Wu and Liu.",Included,Included
100,Genetically determined intelligence and coronary artery disease risk,"BACKGROUND: Epidemiological studies have shown inverse association between intelligence and coronary artery disease (CAD) risk, but the underlying mechanisms remain unclear., METHODS: Based on 242 SNPs independently associated with intelligence, we calculated the genetic intelligence score (gIQ) for participants from 10 CAD case-control studies (n = 34,083) and UK Biobank (n = 427,306). From UK Biobank, we extracted phenotypes including body mass index (BMI), type 2 diabetes (T2D), smoking, hypertension, HDL cholesterol, LDL cholesterol, measured intelligence score, and education attainment. To estimate the effects of gIQ on CAD and its related risk factors, regression analyses was applied. Next, we studied the mediatory roles of measured intelligence and educational attainment. Lastly, Mendelian randomization was performed to validate the findings., RESULTS: In CAD case-control studies, one standard deviation (SD) increase of gIQ was related to a 5% decrease of CAD risk (odds ratio [OR] of 0.95; 95% confidence interval [CI] 0.93 to 0.98; P = 4.93e-5), which was validated in UK Biobank (OR = 0.97; 95% CI 0.96 to 0.99; P = 6.4e-4). In UK Biobank, we also found significant inverse correlations between gIQ and risk factors of CAD including smoking, BMI, T2D, hypertension, and a positive correlation with HDL cholesterol. The association signals between gIQ and CAD as well as its risk factors got largely attenuated after the adjustment of measured intelligence and educational attainment. The causal role of intelligence in mediating CAD risk was confirmed by Mendelian randomization analyses., CONCLUSION: Genetic components of intelligence affect measured intelligence and educational attainment, which subsequently affect the prevalence of CAD via a series of unfavorable risk factor profiles.",Included,Included
